message,user_id,class_id,op_tags,sum_content_text
"用户：我是� Dreamboat
用户：楠夕老师，2.17开课，现在需要做什么准备
用户：1⃣收到图书还未核对
2⃣群已加入
3⃣时间不固定，但是应该可以完成
4⃣可能时间有些紧张尽量参加
用户：谢谢分享
用户：刚刚打开包裹
用户：今天先开始小猴子下山这个是吗
老师：对滴
用户：崽崽上学去了，等他回来再带他开始
老师：好滴哟
用户：这个是什么
老师：这个是亲子阅读卡
用户：谢谢楠夕老师
老师：在的，子坤妈妈
老师：怎么啦？
用户：叫叫这个阅读我买的这个只有一年时间可以看吗
用户：不续定也可以看吗
老师：是的哟
老师：课程是一直可以看的哟
老师：不用担心
老师：嗯嗯没事的
用户：这个导图怎么用呀",78248684,61442,M0,"课程表现：
行为习惯：
生活情况：孩子正在上学，家长时间不固定但能完成课程学习
家长需求：家长关心孩子课程准备情况及课程观看期限，对课程有一定了解需求
规划安排：
沟通态度：回复积极，主动沟通课程相关问题"
"用户：谢子坤还差一个补读对吧
老师：现在已经更上进度啦，每天按时完成就ok哟
用户：昨晚很晚还在补
用户：他爸爸都叫他睡觉
老师：这是一条引用/回复消息：
""他爸爸都叫他睡觉""
------
[恐惧]那看来宝贝还是很认真的
用户：我们完成了",78248684,61442,M3,"课程表现：孩子之前有补读情况，现已跟上进度，且完成课程态度认真
行为习惯：
生活情况：
家长需求：
规划安排：
沟通态度：主动沟通，积极反馈孩子课程完成情况"
"老师：阅读开始了吗？
用户：崽崽正在读
老师：好勒好勒～
老师：看到宝宝的视频，其实就发现宝宝的点数能力还是很好的，一个一个的去点数。
老师：并且点数之后，他能够总结到正确的数字，因为嗯，有一部分好朋友，他是1234，总得有几个，5个，就是他没有总结的能力，宝宝是有总结能力的，是非常的棒的。
老师：不过有一点点要提醒我，宝贝他在做游戏页的时候，他的头是趴到桌子上的，这样子的话对于眼睛的保护是不是太好，所以在做游戏机的时候，我们的背要打直，眼睛要抬起来一点点，这样的话会对我们的眼睛更好一些。
用户：领取了谢谢老师
用户：这些零碎的课太多了，我没那么多精力去帮助我崽去学习
用户：我的时间点和我儿子套不起
用户：已经完成啦！正在玩游戏
老师：看到宝宝在点数，嗯，数的还是很好的，说明手眼协调的能力是非常棒的呢。
老师：宝贝拿笔的姿势还是很不错的呢，拿的很好哟。
老师：好的呢，宝贝。",78248684,61442,M4,"课程表现：孩子点数能力和总结能力好，手眼协调能力棒，拿笔姿势不错
行为习惯：孩子做游戏页时头会趴在桌子上
生活情况：家长时间和孩子学习时间无法匹配，精力有限难以陪学
家长需求：
规划安排：
沟通态度：回复积极"
"用户：最近带孩子在外旅游
用户：都没有看叫叫了[破涕为笑]
用户：不是出去旅游了吗[破涕为笑]
老师：我忘记请假备注了
老师：sorry哈、
老师：出去玩多久呀，子坤妈妈[捂脸]
用户：今天刚回来
用户：玩了5天
用户：这会影响他吗？
用户：缺了这么多次
用户：在阅读哦[害羞]
用户：我最近不在家
用户：他爸爸带着孩子阅读呢
老师：好哟～
用户：今晚陪伴孩子
老师：好哟",78248684,61442,M2,"课程表现：
行为习惯：
生活情况：家长带孩子旅游5天刚回来，家长近期不在家，孩子由爸爸带着阅读，今晚家长陪伴孩子
家长需求：家长担心孩子缺课有影响，关心孩子课程情况
规划安排：
沟通态度：主动沟通，积极交流"
